{
	"$schema": "https://raw.githubusercontent.com/earendil-works/ice/main/packages/coding-agent/src/modes/interactive/theme/theme-schema.json",
	"name": "light-sunset",
	"vars": {
		"golden": "#d4a259",
		"coral": "#ff8b6a",
		"peach": "#ffb494",
		"lavender": "#b896d4",
		"duskPurple": "#8b6fa3",
		"warmBrown": "#9d7654",
		"cream": "#fff4e6",
		"softPeach": "#ffe8d5",
		"paleOrange": "#ffd4b8",
		"mediumWarm": "#8a7568",
		"dimWarm": "#a89080",
		"lightWarm": "#c9b8a8",
		"selectedBg": "#ffdec9",
		"userMsgBg": "#fff0e0",
		"toolPendingBg": "#fef5ed",
		"toolSuccessBg": "#fff3e6",
		"toolErrorBg": "#ffe8df",
		"customMsgBg": "#f8ebff"
	},
	"colors": {
		"accent": "golden",
		"border": "coral",
		"borderAccent": "golden",
		"borderMuted": "lightWarm",
		"success": "#c49a6c",
		"error": "#d47766",
		"warning": "golden",
		"muted": "mediumWarm",
		"dim": "dimWarm",
		"text": "",
		"thinkingText": "mediumWarm",
		"selectedBg": "selectedBg",
		"userMessageBg": "userMsgBg",
		"userMessageText": "",
		"customMessageBg": "customMsgBg",
		"customMessageText": "",
		"customMessageLabel": "lavender",
		"toolPendingBg": "toolPendingBg",
		"toolSuccessBg": "toolSuccessBg",
		"toolErrorBg": "toolErrorBg",
		"toolTitle": "",
		"toolOutput": "mediumWarm",
		"mdHeading": "coral",
		"mdLink": "duskPurple",
		"mdLinkUrl": "dimWarm",
		"mdCode": "golden",
		"mdCodeBlock": "warmBrown",
		"mdCodeBlockBorder": "mediumWarm",
		"mdQuote": "mediumWarm",
		"mdQuoteBorder": "mediumWarm",
		"mdHr": "mediumWarm",
		"mdListBullet": "peach",
		"toolDiffAdded": "#a87f5c",
		"toolDiffRemoved": "#c47a6a",
		"toolDiffContext": "mediumWarm",
		"syntaxComment": "#968264",
		"syntaxKeyword": "#d4704d",
		"syntaxFunction": "#b8832f",
		"syntaxVariable": "#8b6fa3",
		"syntaxString": "#c75d4f",
		"syntaxNumber": "#d4a259",
		"syntaxType": "#9d7654",
		"syntaxOperator": "#8a7568",
		"syntaxPunctuation": "#8a7568",
		"thinkingOff": "lightWarm",
		"thinkingMinimal": "#b89f8f",
		"thinkingLow": "peach",
		"thinkingMedium": "golden",
		"thinkingHigh": "duskPurple",
		"thinkingXhigh": "#7a5d8e",
		"bashMode": "warmBrown"
	},
	"export": {
		"pageBg": "#fffcf5",
		"cardBg": "#ffffff",
		"infoBg": "#fff8ed"
	}
}
