{
	"$schema": "https://raw.githubusercontent.com/earendil-works/ice/main/packages/coding-agent/src/modes/interactive/theme/theme-schema.json",
	"name": "light-lavender",
	"vars": {
		"cyan": "#00acc1",
		"blue": "#5e35b1",
		"green": "#43a047",
		"red": "#e53935",
		"yellow": "#fdd835",
		"gray": "#4527a0",
		"dimGray": "#7e57c2",
		"darkGray": "#d1c4e9",
		"accent": "#7e57c2",
		"selectedBg": "#ede7f6",
		"userMsgBg": "#f3e5f5",
		"toolPendingBg": "#f2eff9",
		"toolSuccessBg": "#e8f5e9",
		"toolErrorBg": "#ffebee",
		"customMsgBg": "#e1bee7"
	},
	"colors": {
		"accent": "accent",
		"border": "blue",
		"borderAccent": "accent",
		"borderMuted": "darkGray",
		"success": "green",
		"error": "red",
		"warning": "yellow",
		"muted": "gray",
		"dim": "dimGray",
		"text": "",
		"thinkingText": "gray",
		"selectedBg": "selectedBg",
		"userMessageBg": "userMsgBg",
		"userMessageText": "",
		"customMessageBg": "customMsgBg",
		"customMessageText": "",
		"customMessageLabel": "accent",
		"toolPendingBg": "toolPendingBg",
		"toolSuccessBg": "toolSuccessBg",
		"toolErrorBg": "toolErrorBg",
		"toolTitle": "",
		"toolOutput": "gray",
		"mdHeading": "#7e57c2",
		"mdLink": "#5e35b1",
		"mdLinkUrl": "dimGray",
		"mdCode": "#673ab7",
		"mdCodeBlock": "#5e35b1",
		"mdCodeBlockBorder": "darkGray",
		"mdQuote": "gray",
		"mdQuoteBorder": "darkGray",
		"mdHr": "darkGray",
		"mdListBullet": "accent",
		"toolDiffAdded": "green",
		"toolDiffRemoved": "red",
		"toolDiffContext": "gray",
		"syntaxComment": "#4527a0",
		"syntaxKeyword": "#5e35b1",
		"syntaxFunction": "#fdd835",
		"syntaxVariable": "#00acc1",
		"syntaxString": "#e53935",
		"syntaxNumber": "#43a047",
		"syntaxType": "#7e57c2",
		"syntaxOperator": "#7e57c2",
		"syntaxPunctuation": "#7e57c2",
		"thinkingOff": "darkGray",
		"thinkingMinimal": "dimGray",
		"thinkingLow": "blue",
		"thinkingMedium": "cyan",
		"thinkingHigh": "accent",
		"thinkingXhigh": "red",
		"bashMode": "accent"
	},
	"export": {
		"pageBg": "#f3e5f5",
		"cardBg": "#f2eff9",
		"infoBg": "#e8f5e9"
	}
}
